{"protocol_version":"0.1","schema":"localize-anything-provider-real-smoke-acceptance-criteria-v1","artifact":"provider-real-smoke-acceptance-criteria.json","status":"defined","criteria":[{"stage":"pre_execution","required_checks":["explicit_scoped_consent","authorization_gate"],"required":true}],"outcomes":{"pass":"provider path executed only","partial":"evidence incomplete","fail":"safety or QA failed"},"successful_smoke_supports_provider_backed_quality":false,"forbidden_claims":["provider_backed_quality"],"provider_or_model_called":false}
